{
  "$schema": "https://json-schema.org/draft/2020-12/schema",
  "$id": "https://misterfix.net/schemas/norkpalm-order-webhook.json",
  "title": "Norkpalm — заказ (вебхук от PlanPlace)",
  "description": "Формат ОДНОГО вебхука, которым PlanPlace передаёт весь заказ в Планфикс. Состоит из двух областей: 'шапка' (contact/orderName/description — кто разместил заказ) и 'items' — массив позиций заказа, по одному объекту на строку. Формат одной позиции описан отдельно в izdelie-schema.json.",
  "type": "object",
  "required": ["contact", "items"],
  "additionalProperties": false,
  "properties": {
    "contact": {
      "type": "object",
      "description": "Контактное лицо, разместившее заказ.",
      "required": ["name", "email"],
      "additionalProperties": false,
      "properties": {
        "name": {
          "type": "string",
          "description": "ФИО контактного лица."
        },
        "email": {
          "type": "string",
          "format": "email",
          "description": "Email контактного лица — по нему заказчик идентифицируется в Планфиксе (используется как ключ поиска/сопоставления контакта, а не просто справочная информация)."
        }
      }
    },
    "orderName": {
      "type": ["string", "null"],
      "description": "Необязательное краткое наименование заказа (для отображения в списках)."
    },
    "description": {
      "type": ["string", "null"],
      "description": "Необязательное описание заказа свободным текстом."
    },
    "items": {
      "type": "array",
      "minItems": 1,
      "description": "Позиции заказа. Каждый элемент — строка изделия по формату izdelie-schema.json. Все справочные значения внутри позиции задаются точными названиями или кодами записи справочника (см. izdelie-reference.json) — числовые внутренние id объектов Планфикса нигде не используются и не передаются.",
      "items": { "$ref": "izdelie-schema.json" }
    }
  }
}
